{
  "meta": {
    "id": "genre-shuangnan",
    "name": "双男主",
    "kind": "genre-prose-card",
    "sub_tags": [
      "双男主",
      "双男主纯爱",
      "BL",
      "纯爱",
      "耽美"
    ],
    "target_platform": "长篇通用",
    "confidence": 0.85,
    "upgrade_status": "seed",
    "provenance": {
      "source": "zenstory-ai/oh-story-claudecode",
      "license": "MIT",
      "copyright": "Copyright (c) 2025-2026 oh-story-claudecode",
      "verified": false,
      "evidence": "样本说明：本地同题材长篇样本，可用 740 本；抽样 24 本，前/中/后章节段 24/24/24，共 72 个。\n正文参考：段落中位约 26.0 字，对话约占 30%，系统/面板提示约 14%。\n使用提醒：只作题材参考，帮你抓常见场面和前中后写法；本书设定与同题材对标仍优先。",
      "converted_at": "2026-09-09T06:21:51+00:00"
    },
    "source_books": []
  },
  "language_rules": {
    "forbidden_elements": [
      "不要把两位主角写成同一种腔",
      "不要只靠外貌互夸",
      "不要让关系线吞掉事件线",
      "不要用工业撒糖代替选择",
      "不要把攻受功能位写死"
    ],
    "banned_phrases": [],
    "voice_notes": "一个人可以冷、毒、端着，另一个人可以混、直、嘴欠、装乖，但不要脸谱化。对话允许答非所问、被动作打断、半句咽回去，重点是两人对同一压力的反应差异。"
  },
  "prose": {
    "sections": {
      "正文提示词": "写双男主时，关系张力要和外部事件一起推进。危险、误判、身份、占有欲、保护欲、同盟压力都能成为关系发动机。每章至少让两人的关系状态发生一点变化：试探限制、被迫合作、互相隐瞒、误会升级、公开维护、危险中选择对方。",
      "开场抓手": "- 优先从危险/异常、被迫同处、公开误会、手机消息、资源交换、师门/校园/职场围观切入。\n- 两位主角一出场就要有差异：行动速度、说话方式、情绪露出方式不能相同。\n- 糖点不要裸放，最好前面带一点风险或误判。",
      "冲突发动机": "外部压力逼近 + 两人目标不完全一致 + 彼此读错。关系线不能脱离主线，主线压力也不能吃掉关系反应。",
      "爽点与情绪释放": "释放来自“他本可以不管，但还是管了”“他嘴上否认，行动已经站队”“外人误判他们关系，结果被事实打脸”。甜要带克制，虐要给下一步安全感。",
      "对话与声线": "一个人可以冷、毒、端着，另一个人可以混、直、嘴欠、装乖，但不要脸谱化。对话允许答非所问、被动作打断、半句咽回去，重点是两人对同一压力的反应差异。",
      "章尾钩子": "适合用身份暴露、危险逼近、误会被第三方放大、其中一人替对方背锅、暧昧证据被围观收尾。钩子要让读者期待关系下一步变化。",
      "场景颗粒": "关系变化要落到手腕、外套、座位距离、聊天记录、挡刀站位、同住空间、公开称呼和第三方误会。不要只写眼神和心跳。",
      "正文落点": "开场落到同处压力、公开误会、危险或手机消息；冲突落到两人目标不一致和外人误判；结尾落到替对方承担后果、暧昧证据被看见或身份暴露。",
      "前中后期打法": "- 前期：用同处压力、公开误会、手机消息或危险场面把两人的目标差异推到台前。\n- 中期：围绕替对方承担后果、限制试探、外人误判和关系证据做拉扯，不靠空泛暧昧。\n- 后期：把私下偏袒推到公开选择，结尾留身份暴露、证据被看见或另一方反过来护短。",
      "节奏密度": "每章主线压力和关系压力至少各有一个小变化。高压章用行动推进感情，低压章也要埋一个外部代价或未说破的误会。",
      "本章取舍": "冲突和暧昧交替。若本章主线强，就用一个关键动作推进关系；若本章关系强，也要留下主线代价。",
      "禁止漂移": "不要把两位主角写成同一种腔；不要只靠外貌互夸；不要让关系线吞掉事件线；不要用工业撒糖代替选择；不要把攻受功能位写死。",
      "证据摘要": "样本说明：本地同题材长篇样本，可用 740 本；抽样 24 本，前/中/后章节段 24/24/24，共 72 个。\n正文参考：段落中位约 26.0 字，对话约占 30%，系统/面板提示约 14%。\n使用提醒：只作题材参考，帮你抓常见场面和前中后写法；本书设定与同题材对标仍优先。"
    }
  },
  "structure": {
    "hook_notes": "适合用身份暴露、危险逼近、误会被第三方放大、其中一人替对方背锅、暧昧证据被围观收尾。钩子要让读者期待关系下一步变化。\n\n开场落到同处压力、公开误会、危险或手机消息；冲突落到两人目标不一致和外人误判；结尾落到替对方承担后果、暧昧证据被看见或身份暴露。",
    "arc_rhythm_notes": "每章主线压力和关系压力至少各有一个小变化。高压章用行动推进感情，低压章也要埋一个外部代价或未说破的误会。\n\n- 前期：用同处压力、公开误会、手机消息或危险场面把两人的目标差异推到台前。\n- 中期：围绕替对方承担后果、限制试探、外人误判和关系证据做拉扯，不靠空泛暧昧。\n- 后期：把私下偏袒推到公开选择，结尾留身份暴露、证据被看见或另一方反过来护短。"
  },
  "commercial": {
    "payoff_notes": "释放来自“他本可以不管，但还是管了”“他嘴上否认，行动已经站队”“外人误判他们关系，结果被事实打脸”。甜要带克制，虐要给下一步安全感。"
  }
}
