{"commercial":{"payoff_notes":"救治要有见证者：名医低头、家属跪谢、权贵圈口碑发酵。打脸要当场兑现：赌约、退婚、医馆踢馆，赢了就收产业、收人心、收美人芳心。"},"language_rules":{"banned_phrases":[],"forbidden_elements":["不要把每次治病写成流水线开药方，救治过程要有悬念、代价和反转","不要让医术万能到失去边界，绝症重症必须有真实难度和代价","不要只写打脸不写医，医术本身的神秘感和专业感是立身之本","不要让配角医生永远降智，偶尔让同行先给出正确思路，主角再超越"],"voice_notes":"主角说话淡然自信，惜字如金，关键时刻一句话定音；纨绔反派话多浮夸，方便打脸；病人家属情绪化，台词带哭腔和哀求。别让所有人只会喊“神医救命”。"},"meta":{"confidence":0.4,"id":"genre-dushi-shenyi","kind":"genre-prose-card","name":"都市神医","provenance":{"converted_at":"2026-09-30T01:50:00+08:00","copyright":"Copyright (c) 2026 novel-lab (agent-authored original seed)","evidence":"本卡为 AI 辅助原创种子卡，未经同题材样本拆书实测；置信度 0.4 为来源自报低值。只作题材参考，帮你抓常见场面和前中后写法；本书设定与同题材对标仍优先。","license":"MIT","source":"novel-lab-agent-authored","verified":false},"source_books":[],"sub_tags":["都市神医","神医","中医","银针渡穴","打脸","悬壶济世","医武双绝"],"target_platform":"长篇通用","upgrade_status":"seed"},"prose":{"sections":{"冲突发动机":"庸医/黑心同行误诊 + 权贵病危 + 纨绔刁难。旁人按资历、年龄、文凭误判主角，主角以医术、胆识和一颗不服的心打破判断。","前中后期打法":"- 前期：用急诊救人、医馆踢馆、退婚打脸立住“神医”人设，积累第一批权贵人脉。\n- 中期：围绕疑难杂症、医道败类、古医方争夺推进，医术要有新绝技解锁。\n- 后期：把医道巅峰对决、宿敌阴谋推到明面上见结果，结尾留隐世医门或更大舞台。","场景颗粒":"用银针包、药香、脉枕、CT片、专家会诊、ICU监护仪、百年老药铺和深夜急诊室的灯承载神医现实感。","对话与声线":"主角淡然自信，惜字如金，关键时刻一句话定音；纨绔反派话多浮夸，方便打脸；病人家属情绪化，台词带哭腔和哀求。别让所有人只会喊“神医救命”。","开场抓手":"- 用急诊室、义诊现场、退婚宴、拍卖会突发急症切入。\n- 先给名医束手无策的绝境，再给主角的破局一针。\n- 医道名词只给当前救治需要的部分，不要开篇背《黄帝内经》。","开篇钩子公式":"- 开局被退婚/被扫地出门，转头当众救人展露医术，反差立威。\n- 权贵突发急症、名医束手无策，主角一针定乾坤。\n- 美女总裁/校花突发隐疾，只有主角能治，以治疗为名贴身接近。","本章取舍":"医术跟着病人走，打脸跟着恩怨走。专业感不能丢，爽感不能等。","正文提示词":"写都市神医，医术是立身之本，打脸是情绪出口。每次出诊都要回答一个问题：为什么非他不可。把“望闻问切”写出悬念感，把银针写出仪式感，病人的身份越尊贵、病情越棘手，反差越强。","正文落点":"开场落到急诊、义诊、退婚宴或拍卖会；冲突落到误诊、踢馆和生死一线；结尾落到名声发酵、新病人登门或仇家现身。","爽点与情绪释放":"救治要有见证者：名医低头、家属跪谢、权贵圈口碑发酵。打脸要当场兑现：赌约、退婚、医馆踢馆，赢了就收产业、收人心、收美人芳心。","示例开篇":"林凡把最后一根银针收回针袋时，急诊室的监护仪终于响起了一声平稳的“滴——”。\n“心率回来了！血压在升！”小护士的声音都在发抖。\n三分钟前，这位被连下三张病危通知书的老人，还躺在床上等死。省里来的三位专家围着会诊了半小时，结论出奇地一致：准备后事。\n可这个穿着地摊T恤、被保安拦在门外的年轻人，只用了九根针。\n“你……你到底是什么人？”院长的手抖得拿不住病历夹。\n林凡擦了擦额头的汗，把针袋往腰间一别，淡淡道：“一个赤脚医生。”\n他转身要走，病房门口却呼啦啦跪下一片——老人的儿子，江城首富沈万山，红着眼睛喊：“神医留步！我沈家愿以一半家产相谢！”","禁止漂移":"不要把每次治病写成流水线开药方，救治过程要有悬念、代价和反转；不要让医术万能到失去边界，绝症重症必须有真实难度和代价；不要只写打脸不写医，医术本身的神秘感和专业感是立身之本；不要让配角医生永远降智。","章尾钩子":"适合用病人身份揭晓更大来头、仇家派杀手伪装成病人、古医方残卷现世、医道大赛邀请收尾。","节奏密度":"每章解决一个病患或一场打脸，医案和恩怨交替推进。救治、打脸、收人脉不要断成互不相关的清单。","证据摘要":"本卡为 AI 辅助原创种子卡，未经同题材样本拆书实测；置信度 0.4 为来源自报低值。只作题材参考，帮你抓常见场面和前中后写法；本书设定与同题材对标仍优先。","语气风格":"爽快干脆、快意恩仇。行文利落，装逼打脸节奏明快；医术描写带神秘感，下针如行云流水；感情线点到为止，暧昧不拖沓。","题材简介":"身怀绝世医术的少年回归都市，银针在手可断生死。救权贵、踩纨绔、斗医道败类，在霓虹与病房之间快意恩仇、悬壶济世。"}},"structure":{"arc_rhythm_notes":"每章解决一个病患或一场打脸，医案和恩怨交替推进。救治、打脸、收人脉不要断成互不相关的清单。前期立人设攒人脉，中期斗医道败类争古医方，后期巅峰对决见结果。","hook_notes":"适合用病人身份揭晓更大来头、仇家派杀手伪装成病人、古医方残卷现世、医道大赛邀请收尾。开场落到急诊、义诊、退婚宴或拍卖会；冲突落到误诊、踢馆和生死一线；结尾落到名声发酵、新病人登门或仇家现身。"}}