{"commercial":{"payoff_notes":"科技碾压要有观众：敌对文明、联邦议会、船员。胜利要讲谋略：不是火力洗地，而是跃迁伏击、信息战、斩首行动。文明存续的重量感，是星际题材独有的爽点。"},"language_rules":{"banned_phrases":[],"forbidden_elements":["不要把科幻写成披着星舰皮的玄幻，科技要有自洽的规则和代价","不要让主角光环代替舰队战术，星际战争是体系对抗","不要堆砌名词不解释，跃迁、曲率、戴森球第一次出现要给人话版解释","不要让外星文明全是人类翻版，异质感是科幻的灵魂"],"voice_notes":"舰长/指挥官说话简短决断，命令式；科学家话多但要有真东西；AI可以有个性，别写成复读机。战斗通讯要短促，日常可以有人味。别让所有人都只会喊“开火”。"},"meta":{"confidence":0.4,"id":"genre-kehuan-xingji","kind":"genre-prose-card","name":"科幻星际","provenance":{"converted_at":"2026-09-30T01:50:00+08:00","copyright":"Copyright (c) 2026 novel-lab (agent-authored original seed)","evidence":"本卡为 AI 辅助原创种子卡，未经同题材样本拆书实测；置信度 0.4 为来源自报低值。只作题材参考，帮你抓常见场面和前中后写法；本书设定与同题材对标仍优先。","license":"MIT","source":"novel-lab-agent-authored","verified":false},"source_books":[],"sub_tags":["科幻星际","星际","机甲","星舰","异星文明","宇宙战争","硬科幻"],"target_platform":"长篇通用","upgrade_status":"seed"},"prose":{"sections":{"冲突发动机":"文明存续危机 + 联邦内斗 + 未知异星威胁。旁人按“边缘人/逃兵/平民”误判主角，主角以指挥天赋、科技奇点和置之死地的勇气打破判断。","前中后期打法":"- 前期：用废船打捞、机甲首战、海盗遭遇战立住“天才指挥/机师”人设，组建初始班底。\n- 中期：围绕舰队战争、异星遗迹、联邦阴谋推进，科技树和舰队规模同步升级。\n- 后期：把文明决战、终极真相推到明面上见结果，结尾留深空远航或新纪元。","场景颗粒":"用舰桥的全息星图、机甲的液压声、空间站的舷窗、跃迁时的蓝光、船员舱的合影承载星际的浪漫与残酷。","对话与声线":"舰长/指挥官说话简短决断，命令式；科学家话多但要有真东西；AI可以有个性，别写成复读机。战斗通讯要短促，日常可以有人味。别让所有人都只会喊“开火”。","开场抓手":"- 用废船坟场、空间站底层、机甲训练场、殖民星球切入。\n- 先给主角的卑微处境，再给一场意外：遗迹、求救信号、战争爆发。\n- 科技名词只给当前场景需要的部分，第一次出现配人话解释。","开篇钩子公式":"- 废船打捞工在残骸里发现远古遗迹/沉睡AI，一夜暴富变通缉犯。\n- 机甲训练场吊车尾在实战中一鸣惊人，被王牌部队挖角。\n- 殖民星球突遭异星舰队袭击，平民少年临危受命。","本章取舍":"科技跟着战争走，浪漫跟着星辰走。硬核感不能丢，爽感不能等。","正文提示词":"写科幻星际，核心是“未知”与“征服”。星舰是舞台，文明是棋子。把战争写出体系感：侦察、补给、通讯、士气，而不只是炮火对轰。把宇宙写出敬畏感：深空的寂静、文明的渺小。","正文落点":"开场落到废船坟场、空间站或训练场；冲突落到遭遇战、遗迹和阴谋；结尾落到战果、晋升或更大威胁。","爽点与情绪释放":"科技碾压要有观众：敌对文明、联邦议会、船员。胜利要讲谋略：不是火力洗地，而是跃迁伏击、信息战、斩首行动。文明存续的重量感，是星际题材独有的爽点。","示例开篇":"警报声把陆尘从休眠舱里拽了出来。\n“警告！警告！未知舰队正在接近废船坟场，预计接触时间：十分钟。”\n陆尘骂了一句，抓起外套就往打捞船的驾驶舱跑。舷窗外，深空里亮起一片不属于任何已知文明的幽绿光点，像撒在黑布上的磷火。\n“这帮海盗疯了？跑坟场来打劫？”\n话音未落，第一道光束擦着船体掠过。陆尘这才看清：那不是海盗。那支舰队的每一艘船，都长得像某种深海生物，狰狞，冰冷，沉默。\n他手忙脚乱地启动引擎，余光瞥见打捞舱里那块昨天刚捞上来的黑色金属板——上面刻着他看不懂的纹路，此刻，那些纹路正在发光。","禁止漂移":"不要把科幻写成披着星舰皮的玄幻，科技要有自洽的规则和代价；不要让主角光环代替舰队战术，星际战争是体系对抗；不要堆砌名词不解释，第一次出现要给人话版解释；不要让外星文明全是人类翻版。","章尾钩子":"适合用遗迹新发现、联邦密令、异星文明主动接触、舰队叛变收尾。","节奏密度":"每章一场战斗或一次发现，战争线和探索线交替推进。战斗、升级、阴谋不要断成互不相关的清单。","证据摘要":"本卡为 AI 辅助原创种子卡，未经同题材样本拆书实测；置信度 0.4 为来源自报低值。只作题材参考，帮你抓常见场面和前中后写法；本书设定与同题材对标仍优先。","语气风格":"恢弘冷峻、浪漫残酷。战争场面写体系，探索场面写敬畏；深空的寂静与炮火的喧嚣交替，文明的重量压在每个决定上。","题材简介":"星舰、机甲、异星文明、宇宙战争。从废船打捞工到舰队指挥官，在深空的寂静与炮火中，写一部文明的史诗。"}},"structure":{"arc_rhythm_notes":"每章一场战斗或一次发现，战争线和探索线交替推进。战斗、升级、阴谋不要断成互不相关的清单。前期立人设组班底，中期舰队战争挖遗迹，后期文明决战见结果。","hook_notes":"适合用遗迹新发现、联邦密令、异星文明主动接触、舰队叛变收尾。开场落到废船坟场、空间站或训练场；冲突落到遭遇战、遗迹和阴谋；结尾落到战果、晋升或更大威胁。"}}