{"commercial":{"payoff_notes":"比武要有观众：武林同道、红颜知己、仇家。赢要赢得漂亮：以弱胜强、以智破力、以德服人。复仇要大快人心：仇家一个一个倒下，恩怨一笔一笔清算。"},"language_rules":{"banned_phrases":[],"forbidden_elements":["不要把武功写成数值游戏，招式要有意境、门派和来历","不要让主角逢战必赢，败仗、重伤、闭关是成长必需的代价","不要把江湖写成只有打打杀杀，酒、朋友、规矩才是江湖的魂","不要让反派全是脸谱化恶人，枭雄也要有他的江湖道义"],"voice_notes":"主角初入江湖时青涩，台词带少年气；成长后沉稳，一诺千金。大侠说话有古韵但不掉书袋；反派枭雄有气度，市井小民有烟火气。别让所有古人只会说“阁下好身手”。"},"meta":{"confidence":0.4,"id":"genre-wuxia-chuantong","kind":"genre-prose-card","name":"传统武侠","provenance":{"converted_at":"2026-09-30T01:50:00+08:00","copyright":"Copyright (c) 2026 novel-lab (agent-authored original seed)","evidence":"本卡为 AI 辅助原创种子卡，未经同题材样本拆书实测；置信度 0.4 为来源自报低值。只作题材参考，帮你抓常见场面和前中后写法；本书设定与同题材对标仍优先。","license":"MIT","source":"novel-lab-agent-authored","verified":false},"source_books":[],"sub_tags":["传统武侠","武侠","江湖","武林秘籍","快意恩仇","剑客","门派"],"target_platform":"长篇通用","upgrade_status":"seed"},"prose":{"sections":{"冲突发动机":"门派恩怨 + 武林秘籍争夺 + 身世之谜。旁人按“无名小卒”误判主角，主角以绝世武功、赤子之心和一诺千金的信条打破判断。","前中后期打法":"- 前期：用初入江湖、奇遇得功、初露锋芒立住“少年侠客”人设，结交第一批生死之交。\n- 中期：围绕武林大会、秘籍争夺、身世揭晓推进，武功要有新境界突破。\n- 后期：把正邪决战、终极仇家推到明面上见结果，结尾留归隐或新的江湖传说。","场景颗粒":"用长剑、酒葫芦、客栈的灯、山间的雾、擂台的彩旗、深夜的篝火承载江湖的烟火气与苍凉感。","对话与声线":"主角初入江湖时青涩，台词带少年气；成长后沉稳，一诺千金。大侠说话有古韵但不掉书袋；反派枭雄有气度，市井小民有烟火气。别让所有古人只会说“阁下好身手”。","开场抓手":"- 用破庙、客栈、山道、擂台切入。\n- 先给少年的落魄或平凡，再给一场奇遇或一场不平事。\n- 武功境界只给当前打斗需要的部分，不要开篇列门派谱系。","开篇钩子公式":"- 少年在破庙/山崖得奇遇，残卷/前辈灌顶，一夜脱胎换骨。\n- 路见不平拔刀相助，救下的人身份不简单。\n- 灭门遗孤/镖局少主背负血海深仇，十年磨一剑出山。","本章取舍":"武功跟着恩怨走，情义跟着酒走。意境不能丢，节奏不能慢。","正文提示词":"写传统武侠，核心是“侠”字。武功是皮，情义是骨。把打斗写出意境：剑气、落叶、月光，而不只是招式名。把江湖写出人情：酒、朋友、规矩，恩怨情仇都要有出处。","正文落点":"开场落到破庙、客栈、山道或擂台；冲突落到仇家追杀、秘籍现世和比武；结尾落到名声渐起、新恩怨或故人重逢。","爽点与情绪释放":"比武要有观众：武林同道、红颜知己、仇家。赢要赢得漂亮：以弱胜强、以智破力、以德服人。复仇要大快人心：仇家一个一个倒下，恩怨一笔一笔清算。","示例开篇":"雨下得正紧，破庙的门板被风拍得哐哐响。\n沈浪把最后一口干粮塞进嘴里，听见庙外传来兵器相击的声音，还有一声女子的闷哼。\n他本不想管。三年前爹娘就是死在“路见不平”这四个字上。\n可那女子的声音又响起来，带着哭腔：“剑谱……我就是死，也不会交出《听潮剑谱》！”\n沈浪的手按住了腰间的柴刀。\n庙门被一脚踹开，三个黑衣人提刀而入，刀尖还滴着血。为首的狞笑道：“小子，不想死就滚开！”\n沈浪叹了口气，站起身，把柴刀横在胸前。\n“这破庙，今晚我包了。”","禁止漂移":"不要把武功写成数值游戏，招式要有意境、门派和来历；不要让主角逢战必赢，败仗、重伤、闭关是成长必需的代价；不要把江湖写成只有打打杀杀，酒、朋友、规矩才是江湖的魂；不要让反派全是脸谱化恶人。","章尾钩子":"适合用神秘人暗中观察、仇家发出战书、秘籍残页现世、故人带来噩耗收尾。","节奏密度":"每章一场打斗或一段奇遇，恩怨和情义交替推进。比武、奇遇、结交不要断成互不相关的清单。","证据摘要":"本卡为 AI 辅助原创种子卡，未经同题材样本拆书实测；置信度 0.4 为来源自报低值。只作题材参考，帮你抓常见场面和前中后写法；本书设定与同题材对标仍优先。","语气风格":"苍凉豪迈、快意恩仇。打斗场面写意境，情感场面写克制；少年气与大侠气并存，酒越喝越暖，剑越磨越利。","题材简介":"少年仗剑入江湖，奇遇、恩怨、红颜、兄弟。快意恩仇的武林，刀光剑影的传说，一部写给“侠”字的长篇。"}},"structure":{"arc_rhythm_notes":"每章一场打斗或一段奇遇，恩怨和情义交替推进。比武、奇遇、结交不要断成互不相关的清单。前期立人设交朋友，中期争秘籍揭身世，后期正邪决战见结果。","hook_notes":"适合用神秘人暗中观察、仇家发出战书、秘籍残页现世、故人带来噩耗收尾。开场落到破庙、客栈、山道或擂台；冲突落到仇家追杀、秘籍现世和比武；结尾落到名声渐起、新恩怨或故人重逢。"}}