{
  "meta": {
    "id": "genre-nvpin-xuanyi",
    "name": "女频悬疑",
    "kind": "genre-prose-card",
    "sub_tags": [
      "女频悬疑",
      "女性悬疑",
      "悬疑言情",
      "女主破案"
    ],
    "target_platform": "长篇通用",
    "confidence": 0.85,
    "upgrade_status": "seed",
    "provenance": {
      "source": "zenstory-ai/oh-story-claudecode",
      "license": "MIT",
      "copyright": "Copyright (c) 2025-2026 oh-story-claudecode",
      "verified": false,
      "evidence": "样本说明：本地同题材长篇样本，可用 134 本；抽样 24 本，前/中/后章节段 24/24/24，共 72 个。\n正文参考：段落中位约 36.0 字，对话约占 30%。\n使用提醒：只作题材参考，帮你抓常见场面和前中后写法；本书设定与同题材对标仍优先。",
      "converted_at": "2026-09-09T06:21:51+00:00"
    },
    "source_books": []
  },
  "language_rules": {
    "forbidden_elements": [
      "不要只破案不写关系压力",
      "不要靠上帝视角讲真相",
      "不要把女主写成被男主全程带飞"
    ],
    "banned_phrases": [],
    "voice_notes": "女主问话要带策略，嫌疑人会闪躲、反问、装无辜。搭档或男主不能替她全程解释，最多提供资源或压力。"
  },
  "prose": {
    "sections": {
      "正文提示词": "写女频悬疑时，把案件/异常和女主关系网绑在一起。线索推进的同时，女主被信任、被误解、被保护或被排斥的状态也要变化。",
      "开场抓手": "案件现场、陌生来电、旧案重启、亲友异常、职场/警方质疑、危险靠近都适合切入。",
      "冲突发动机": "案件压力 + 女性处境/关系压力 + 信息差。破案之外，女主的位置也要被改变。",
      "爽点与情绪释放": "释放来自女主发现别人忽略的细节、摆脱误解、反向试探成功、让亲近者或权威重新评估她。破案爽和关系爽要互相咬合。",
      "对话与声线": "女主问话要带策略，嫌疑人会闪躲、反问、装无辜。搭档或男主不能替她全程解释，最多提供资源或压力。",
      "章尾钩子": "用新线索、嫌疑人反转、亲近者涉案、女主被盯上、旧案物证出现收尾。",
      "场景颗粒": "用现场痕迹、监控、聊天记录、旧物、气味、药瓶、病历、报案记录、亲友反常举动承载线索。线索要能被角色接触和误读。",
      "正文落点": "开场落到案件现场、陌生来电、亲友异常或旧案物证；冲突落到线索误读和女主关系网压力；结尾落到新线索、嫌疑人反转或亲近者涉案。",
      "前中后期打法": "- 前期：用案件现场、陌生来电、亲友异常或旧物证引女主入局，危险要贴近关系网。\n- 中期：让线索误读、情感压力和嫌疑人反转互相牵制，解一个小真相就暴露一个更近的人。\n- 后期：把旧案、亲近者和新证据合成公开风险，结尾落到嫌疑身份翻转或女主被盯上。",
      "节奏密度": "每章至少给一个新线索和一个新误导，并改变女主在关系网中的安全程度。不要连续只堆谜面不改变处境。",
      "本章取舍": "案件章少写恋爱解释，关系章也要让线索推进一点。恐惧和情感都要落在女主当前可感知的信息上。",
      "禁止漂移": "不要只破案不写关系压力；不要靠上帝视角讲真相；不要把女主写成被男主全程带飞。",
      "证据摘要": "样本说明：本地同题材长篇样本，可用 134 本；抽样 24 本，前/中/后章节段 24/24/24，共 72 个。\n正文参考：段落中位约 36.0 字，对话约占 30%。\n使用提醒：只作题材参考，帮你抓常见场面和前中后写法；本书设定与同题材对标仍优先。"
    }
  },
  "structure": {
    "hook_notes": "用新线索、嫌疑人反转、亲近者涉案、女主被盯上、旧案物证出现收尾。\n\n开场落到案件现场、陌生来电、亲友异常或旧案物证；冲突落到线索误读和女主关系网压力；结尾落到新线索、嫌疑人反转或亲近者涉案。",
    "arc_rhythm_notes": "每章至少给一个新线索和一个新误导，并改变女主在关系网中的安全程度。不要连续只堆谜面不改变处境。\n\n- 前期：用案件现场、陌生来电、亲友异常或旧物证引女主入局，危险要贴近关系网。\n- 中期：让线索误读、情感压力和嫌疑人反转互相牵制，解一个小真相就暴露一个更近的人。\n- 后期：把旧案、亲近者和新证据合成公开风险，结尾落到嫌疑身份翻转或女主被盯上。"
  },
  "commercial": {
    "payoff_notes": "释放来自女主发现别人忽略的细节、摆脱误解、反向试探成功、让亲近者或权威重新评估她。破案爽和关系爽要互相咬合。"
  }
}
