{
  "meta": {
    "id": "genre-haomen-zongcai",
    "name": "豪门总裁",
    "kind": "genre-prose-card",
    "sub_tags": [
      "豪门总裁",
      "霸总",
      "京圈",
      "先婚后爱",
      "契约婚姻"
    ],
    "target_platform": "长篇通用",
    "confidence": 0.85,
    "upgrade_status": "seed",
    "provenance": {
      "source": "zenstory-ai/oh-story-claudecode",
      "license": "MIT",
      "copyright": "Copyright (c) 2025-2026 oh-story-claudecode",
      "verified": false,
      "evidence": "样本说明：本地同题材长篇样本，可用 4457 本；抽样 24 本，前/中/后章节段 24/24/24，共 72 个。\n正文参考：段落中位约 23.0 字，对话约占 31%，系统/面板提示约 8%。\n使用提醒：只作题材参考，帮你抓常见场面和前中后写法；本书设定与同题材对标仍优先。",
      "converted_at": "2026-09-09T06:21:51+00:00"
    },
    "source_books": []
  },
  "language_rules": {
    "forbidden_elements": [
      "不要只堆品牌和豪宅",
      "不要让霸总成为命令机器",
      "不要所有矛盾都靠“听我解释”消失",
      "不要把女主主动性写没",
      "不要用成人式油腻台词替代真实拉扯"
    ],
    "banned_phrases": [],
    "voice_notes": "霸总可以短、稳、克制，但不能只会命令。女主台词要有自尊和限制。亲密戏对话重潜台词：不全说破，用停顿、转移话题、反问、嘴硬承接情绪。"
  },
  "prose": {
    "sections": {
      "正文提示词": "写豪门总裁时，核心放在亲密关系里的权力差、误会、契约、公开身份和安全感。奢侈品只做能改变局势的抓手。每章要让关系发生可见变化：靠近、退开、试探、护短、吃醋、揭身份、把分寸说清或旧误会加深。甜点和虐点都要落到具体场景。",
      "开场抓手": "- 优先用家庭逼迫、婚约契约、酒店医院、相亲宴会、手机热搜、公司公开场切入。\n- 第一场要有关系压力，别先写豪门陈设。\n- 男强女强或强弱差都可以，但弱位一方要有选择和反击，不做纯被摆布道具。",
      "冲突发动机": "亲密需求 + 身份/资源不对等 + 信息差。误会不能靠一句解释解决，要有面子、家族、舆论、合同或旧伤作为阻力。",
      "爽点与情绪释放": "女频爽点常来自当众维护、分寸确认、恶意者失算、资源转向女主、男主从冷到偏爱。释放时写动作和场内反应，少用“安全感拉满”这类总结。",
      "对话与声线": "霸总可以短、稳、克制，但不能只会命令。女主台词要有自尊和限制。亲密戏对话重潜台词：不全说破，用停顿、转移话题、反问、嘴硬承接情绪。",
      "章尾钩子": "适合用身份暴露、旧人出现、热搜爆料、家族电话、契约条款反噬、男主公开站队收尾。钩子要继续压关系，别只换一个新误会。",
      "场景颗粒": "关系压力落到合同、戒指、病历、热搜、家族电话、董事会、酒店门卡、车内空间、公开座位和转账记录。豪门感靠资源如何改变局面。",
      "正文落点": "开场落到合同、医院、宴会、热搜、家族饭桌或电梯偶遇；冲突落到阶层体面、契约限制和私下失控；结尾落到关系被公开、协议变更、旧情回归或家族施压。",
      "前中后期打法": "- 前期：用合同、医院、宴会、热搜、家族饭桌或电梯偶遇压关系分寸和阶层差。\n- 中期：围绕契约条款、家族施压、旧情回归和私下失控推进，每章让关系明确前进或后退。\n- 后期：把公开身份、协议变更和家族站队推到结算，章尾继续压关系风险，不只制造新误会。",
      "节奏密度": "每章至少让关系状态前进或后退一步：误会加深、分寸确认、公开维护、旧伤暴露、契约反噬。不要连续只堆暧昧。",
      "本章取舍": "关系压力先行，豪门物件只选一个能改变局势的抓手。强情绪后留半拍冷却，让读者看见下一次关系风险。",
      "禁止漂移": "不要只堆品牌和豪宅；不要让霸总成为命令机器；不要所有矛盾都靠“听我解释”消失；不要把女主主动性写没；不要用成人式油腻台词替代真实拉扯。",
      "证据摘要": "样本说明：本地同题材长篇样本，可用 4457 本；抽样 24 本，前/中/后章节段 24/24/24，共 72 个。\n正文参考：段落中位约 23.0 字，对话约占 31%，系统/面板提示约 8%。\n使用提醒：只作题材参考，帮你抓常见场面和前中后写法；本书设定与同题材对标仍优先。"
    }
  },
  "structure": {
    "hook_notes": "适合用身份暴露、旧人出现、热搜爆料、家族电话、契约条款反噬、男主公开站队收尾。钩子要继续压关系，别只换一个新误会。\n\n开场落到合同、医院、宴会、热搜、家族饭桌或电梯偶遇；冲突落到阶层体面、契约限制和私下失控；结尾落到关系被公开、协议变更、旧情回归或家族施压。",
    "arc_rhythm_notes": "每章至少让关系状态前进或后退一步：误会加深、分寸确认、公开维护、旧伤暴露、契约反噬。不要连续只堆暧昧。\n\n- 前期：用合同、医院、宴会、热搜、家族饭桌或电梯偶遇压关系分寸和阶层差。\n- 中期：围绕契约条款、家族施压、旧情回归和私下失控推进，每章让关系明确前进或后退。\n- 后期：把公开身份、协议变更和家族站队推到结算，章尾继续压关系风险，不只制造新误会。"
  },
  "commercial": {
    "payoff_notes": "女频爽点常来自当众维护、分寸确认、恶意者失算、资源转向女主、男主从冷到偏爱。释放时写动作和场内反应，少用“安全感拉满”这类总结。"
  }
}
