{"commercial":{"payoff_notes":"开棺要有观众：同行、仇家、直播间的看客。宝贝出土要有仪式感：灯光、尘埃、千年的呼吸。脱险要靠真本事：机关术、风水、分金定穴，而不是主角光环。"},"language_rules":{"banned_phrases":[],"forbidden_elements":["不要把古墓写成游乐场，机关、粽子、诅咒要有真实危险和代价","不要让风水玄学沦为空话，分金定穴、机关破解要有可看的推理过程","不要美化盗墓，守住底线：不盗忠烈、不害同行、不碰不该碰的东西","不要让粽子只会追人，墓主人的执念、生前故事才是恐怖的根"],"voice_notes":"老江湖说话留三分，黑话多；主角冷静，关键时刻下决断；新人话多胆小，负责问出读者想问的问题。墓里说话要压低声音，文字也要有压迫感。别让所有人都只会喊“快跑”。"},"meta":{"confidence":0.4,"id":"genre-xuanyi-daomu","kind":"genre-prose-card","name":"悬疑盗墓","provenance":{"converted_at":"2026-09-30T01:50:00+08:00","copyright":"Copyright (c) 2026 novel-lab (agent-authored original seed)","evidence":"本卡为 AI 辅助原创种子卡，未经同题材样本拆书实测；置信度 0.4 为来源自报低值。只作题材参考，帮你抓常见场面和前中后写法；本书设定与同题材对标仍优先。","license":"MIT","source":"novel-lab-agent-authored","verified":false},"source_books":[],"sub_tags":["悬疑盗墓","盗墓","古墓","机关","摸金校尉","探险","风水"],"target_platform":"长篇通用","upgrade_status":"seed"},"prose":{"sections":{"冲突发动机":"古墓机关 + 同行黑吃黑 + 墓主人千年执念。旁人按“小贼/书呆子”误判主角，主角以风水造诣、机关术和过人的胆识打破判断。","前中后期打法":"- 前期：用小墓练手、初入大墓、第一次见血立住“摸金传人”人设，组建固定班底。\n- 中期：围绕大墓连环、千年谜团、同行内鬼推进，机关难度和墓的规格同步升级。\n- 后期：把终极古墓、幕后黑手推到明面上见结果，结尾留金盆洗手或新的传说。","场景颗粒":"用洛阳铲、手电的光柱、墓道的霉味、青铜器的锈、壁画上的朱砂、盗洞外的月光承载地下的阴森与神秘。","对话与声线":"老江湖说话留三分，黑话多；主角冷静，关键时刻下决断；新人话多胆小，负责问出读者想问的问题。墓里说话要压低声音，文字也要有压迫感。别让所有人都只会喊“快跑”。","开场抓手":"- 用古玩市场、深夜盗洞、祖传笔记、工地挖出古墓切入。\n- 先给主角的平凡生活，再给一件异物/一封信打破平静。\n- 风水术语只给当前探墓需要的部分，不要开篇讲《葬经》。","开篇钩子公式":"- 祖传的摸金符/笔记重现江湖，主角被迫/主动下第一斗。\n- 工地/修路挖出古墓，主角被请去“掌眼”，一去不回。\n- 同行失踪前寄来半张地图，主角循着线索入局。","本章取舍":"机关跟着墓走，恐怖跟着人心走。神秘感不能丢，节奏不能拖。","正文提示词":"写悬疑盗墓，核心是“未知”与“敬畏”。墓是舞台，人心是戏。把机关写出巧思：连环、反盗、心理战。把恐怖写出层次：环境压迫、未知恐惧、人性之恶。记住：最可怕的永远不是粽子，是同行。","正文落点":"开场落到古玩市场、盗洞或工地；冲突落到机关、粽子和黑吃黑；结尾落到宝贝出土、谜团加深或减员。","爽点与情绪释放":"开棺要有观众：同行、仇家、直播间的看客。宝贝出土要有仪式感：灯光、尘埃、千年的呼吸。脱险要靠真本事：机关术、风水、分金定穴，而不是主角光环。","示例开篇":"王胖子说，这斗里的东西，能让他孙子都不用干活。\n我说，孙子干不干活我不知道，但这斗要是下了，咱俩的孙子可能就没爷爷了。\n话是这么说，可当那半张帛书摆在我面前时，我的手还是抖了。\n帛书上画的，是传说中的“九龙抬棺”——我爷爷找了一辈子，到死都没找到的东西。\n而寄来帛书的人，是我三年没联系的师兄。信封里除了帛书，还有一张纸条，上面只有七个字：\n“别来，来了就走不了。”\n字迹是师兄的，纸是新的，墨是……血写的。\n我把纸条烧了，把帛书揣进怀里，给胖子发了条消息：“收拾家伙，干一票大的。”","禁止漂移":"不要把古墓写成游乐场，机关、粽子、诅咒要有真实危险和代价；不要让风水玄学沦为空话，破解要有可看的推理过程；不要美化盗墓，守住底线；不要让粽子只会追人，墓主人的执念才是恐怖的根。","章尾钩子":"适合用墓道深处传来异响、壁画内容与传说不符、队伍中有人行为异常、新的盗洞出现收尾。","节奏密度":"每章一个机关或一次反转，探墓线和解谜线交替推进。机关、恐怖、内鬼不要断成互不相关的清单。","证据摘要":"本卡为 AI 辅助原创种子卡，未经同题材样本拆书实测；置信度 0.4 为来源自报低值。只作题材参考，帮你抓常见场面和前中后写法；本书设定与同题材对标仍优先。","语气风格":"阴森神秘、步步惊心。地下场面写压迫，解谜场面写巧思；恐怖要层层递进，人性的恶要在最意想不到处现形。","题材简介":"古墓探险、机关解谜、摸金校尉。一铲一符一下斗，在千年墓道里破解谜团、直面人心，写一部地下的冒险史诗。"}},"structure":{"arc_rhythm_notes":"每章一个机关或一次反转，探墓线和解谜线交替推进。机关、恐怖、内鬼不要断成互不相关的清单。前期练手组班底，中期大墓连环挖谜团，后期终极古墓见结果。","hook_notes":"适合用墓道深处传来异响、壁画内容与传说不符、队伍中有人行为异常、新的盗洞出现收尾。开场落到古玩市场、盗洞或工地；冲突落到机关、粽子和黑吃黑；结尾落到宝贝出土、谜团加深或减员。"}}