{"commercial":{"payoff_notes":"破案要有观众：受害者家属、媒体、凶手本人。真相揭晓要有仪式感：证据链一条一条摆出来，凶手的心理防线一层一层剥开。高潮是审讯室里的对峙，不是枪战。"},"language_rules":{"banned_phrases":[],"forbidden_elements":["不要让主角靠灵感破案，每条推理都要有证据支撑","不要把法医/刑技写成摆设，专业细节是刑侦文的立身之本","不要让凶手降智送人头，高智商对决才好看","不要消费真实案件，虚构案件要有虚构的边界感"],"voice_notes":"主角（刑警/法医）专业冷静，汇报案情时条理分明；老刑警有生活气，说话带糙劲；凶手平时越正常，暴露时反差越大。审讯对话要短兵相接。别让所有人都只会喊“凶手太残忍了”。"},"meta":{"confidence":0.4,"id":"genre-xuanyi-xingzhen","kind":"genre-prose-card","name":"悬疑刑侦","provenance":{"converted_at":"2026-09-30T01:50:00+08:00","copyright":"Copyright (c) 2026 novel-lab (agent-authored original seed)","evidence":"本卡为 AI 辅助原创种子卡，未经同题材样本拆书实测；置信度 0.4 为来源自报低值。只作题材参考，帮你抓常见场面和前中后写法；本书设定与同题材对标仍优先。","license":"MIT","source":"novel-lab-agent-authored","verified":false},"source_books":[],"sub_tags":["悬疑刑侦","刑侦","法医","连环命案","推理","悬疑","破案"],"target_platform":"长篇通用","upgrade_status":"seed"},"prose":{"sections":{"冲突发动机":"连环命案 + 真凶逍遥法外 + 警队内部压力/内鬼。旁人按“菜鸟/书呆子”误判主角，主角以缜密的逻辑、专业的法医/刑侦技术和不服输的韧劲打破判断。","前中后期打法":"- 前期：用第一具尸体、专案组成立、第一次勘查立住“神探/法医”人设，铺开案件线。\n- 中期：围绕连环案升级、真凶挑衅、内部阻力推进，证据链逐步收紧。\n- 后期：把终极对决、真凶身份推到明面上见结果，结尾留新的悬案或主角的心结。","场景颗粒":"用警戒线、勘查灯、物证袋、解剖台的冷光、审讯室的单面镜、深夜办公室的泡面承载刑侦的真实与疲惫。","对话与声线":"主角（刑警/法医）专业冷静，汇报案情时条理分明；老刑警有生活气，说话带糙劲；凶手平时越正常，暴露时反差越大。审讯对话要短兵相接。别让所有人都只会喊“凶手太残忍了”。","开场抓手":"- 用晨跑者发现尸体、报警电话、解剖室、案发现场切入。\n- 先给尸体的冲击力，再给第一个反常细节。\n- 专业术语只给当前勘查需要的部分，不要开篇上法医学课。","开篇钩子公式":"- 晨跑/钓鱼/夜班发现尸体，死状离奇，现场留下一句挑衅。\n- 法医在解剖台上发现不属于死者的东西，案件转向。\n- 十年前的悬案重现，作案手法一模一样。","本章取舍":"证据跟着现场走，悬念跟着凶手走。逻辑感不能丢，节奏不能拖。","正文提示词":"写悬疑刑侦，核心是“逻辑”与“人性”。案件是谜面，人性是谜底。把勘查写出专业感：痕迹、法医、技侦各有分工。把凶手写出人味：动机要让人不寒而栗，而不是变态标签。","正文落点":"开场落到案发现场、解剖室或报警电话；冲突落到证据矛盾、真凶挑衅和内部压力；结尾落到证据链收紧、新尸体或真凶现身。","爽点与情绪释放":"破案要有观众：受害者家属、媒体、凶手本人。真相揭晓要有仪式感：证据链一条一条摆出来，凶手的心理防线一层一层剥开。高潮是审讯室里的对峙，不是枪战。","示例开篇":"尸体是在凌晨四点被发现的，地点是城南公园的人工湖。\n报案的是个晨跑的大爷，吓得连鞋都跑掉了一只。\n沈青赶到时，法医老周已经蹲在湖边抽第二根烟了。\n“死者女性，二十五岁左右，死亡时间不超过六小时。”老周把烟掐了，指了指尸体的手，“看这个。”\n死者的右手紧紧攥着，指缝里露出半张纸条。沈青戴上手套，小心翼翼地展开——\n上面用血写着四个字：\n“下一个，是你。”\n沈青的后颈一凉。他认得这种笔迹。三天前，城西那具尸体的胃里，也有一张字条，字迹一模一样。","禁止漂移":"不要让主角靠灵感破案，每条推理都要有证据支撑；不要把法医/刑技写成摆设，专业细节是立身之本；不要让凶手降智送人头；不要消费真实案件，虚构要有边界感。","章尾钩子":"适合用新的物证出现、嫌疑人不在场证明被推翻、真凶主动联系警方、专案组内部泄密收尾。","节奏密度":"每章一个证据或一次反转，案件线和人物线交替推进。勘查、推理、抓捕不要断成互不相关的清单。","证据摘要":"本卡为 AI 辅助原创种子卡，未经同题材样本拆书实测；置信度 0.4 为来源自报低值。只作题材参考，帮你抓常见场面和前中后写法；本书设定与同题材对标仍优先。","语气风格":"冷静缜密、压抑紧张。勘查场面写专业，推理场面写逻辑；城市的霓虹与罪恶交替，正义要在证据链上一步一步走。","题材简介":"连环命案、法医/刑警主角、逻辑推理。在血迹与证据之间抽丝剥茧，与高智商凶手斗智斗勇，写一部硬核刑侦长篇。"}},"structure":{"arc_rhythm_notes":"每章一个证据或一次反转，案件线和人物线交替推进。勘查、推理、抓捕不要断成互不相关的清单。前期立人设铺案件，中期证据收紧凶手挑衅，后期对决见真相。","hook_notes":"适合用新的物证出现、嫌疑人不在场证明被推翻、真凶主动联系警方、专案组内部泄密收尾。开场落到案发现场、解剖室或报警电话；冲突落到证据矛盾、真凶挑衅和内部压力；结尾落到证据链收紧、新尸体或真凶现身。"}}