{
  "meta": {
    "id": "genre-zhanshen-zhuixu",
    "name": "战神赘婿",
    "kind": "genre-prose-card",
    "sub_tags": [
      "战神赘婿",
      "赘婿",
      "战神回归",
      "隐藏身份"
    ],
    "target_platform": "长篇通用",
    "confidence": 0.85,
    "upgrade_status": "seed",
    "provenance": {
      "source": "zenstory-ai/oh-story-claudecode",
      "license": "MIT",
      "copyright": "Copyright (c) 2025-2026 oh-story-claudecode",
      "verified": false,
      "evidence": "样本说明：本地同题材长篇样本，可用 1404 本；抽样 24 本，前/中/后章节段 24/24/24，共 72 个。\n正文参考：段落中位约 25.0 字，对话约占 31%。\n使用提醒：只作题材参考，帮你抓常见场面和前中后写法；本书设定与同题材对标仍优先。",
      "converted_at": "2026-09-09T06:21:51+00:00"
    },
    "source_books": []
  },
  "language_rules": {
    "forbidden_elements": [
      "不要只让反派无脑骂",
      "不要主角无理由隐忍",
      "不要反转没有证据和见证",
      "不要把妻子写成纯奖品"
    ],
    "banned_phrases": [],
    "voice_notes": "家族反派可以尖酸，但要有利益诉求；妻子/亲密对象要有自己的判断，不只负责被救。主角台词少解释身份，多用承诺、反问和行动压场。"
  },
  "prose": {
    "sections": {
      "正文提示词": "写战神赘婿时，围绕被看轻的身份、羞辱、隐忍理由、身份/实力反转和当众打脸运转。每章先给具体压迫，再给主角一个可以忍或不忍的选择，最后见结果身份、资源或实力差距。",
      "开场抓手": "家族羞辱、妻子受委屈、合同被抢、宴会公开贬低、危急救场、旧部找上门都适合切入。",
      "冲突发动机": "赘婿被看轻 + 隐藏身份 + 见证者围观。隐忍必须有理由：保护关系、查幕后、顾及承诺或等待时机。",
      "爽点与情绪释放": "释放来自当众反转、旧部称呼、资源到场、恶人失算、妻子/家族态度变化。见证者必须在场。",
      "对话与声线": "家族反派可以尖酸，但要有利益诉求；妻子/亲密对象要有自己的判断，不只负责被救。主角台词少解释身份，多用承诺、反问和行动压场。",
      "章尾钩子": "适合用旧部现身、身份线索暴露、妻子态度变化、反派搬更大靠山、下一场公开场合收尾。",
      "场景颗粒": "常用宴会、合同、公司门口、医院、家族饭桌、豪车/车牌、旧部称呼、转账记录、邀请函。反转必须有见证者和证据。",
      "正文落点": "开场落到家族饭桌、宴会、合同、医院或旧部上门；冲突落到被看轻的处境和隐忍理由；结尾落到旧部称呼、资源到场、妻子态度变化或更大靠山。",
      "前中后期打法": "- 前期：用家族饭桌、医院、宴会、合同或旧部上门制造被看轻的处境，同时给隐忍理由。\n- 中期：让危险、靠山、资源和妻子态度轮流变动，打脸必须分层，不要一次亮完身份。\n- 后期：把旧部称呼、资源到场和更大靠山推成公开清算，结尾回到妻子或家族关系变化。",
      "节奏密度": "每章先给具体压迫，再给隐忍理由，最后至少见结果一个身份、资源或实力差距。不能连续多章只受辱不回击。",
      "本章取舍": "如果要隐忍，必须写清保护谁、查什么或等什么。妻子线、家族线、敌人线每章选一条主压迫线，避免反派群骂。",
      "禁止漂移": "不要只让反派无脑骂；不要主角无理由隐忍；不要反转没有证据和见证；不要把妻子写成纯奖品。",
      "证据摘要": "样本说明：本地同题材长篇样本，可用 1404 本；抽样 24 本，前/中/后章节段 24/24/24，共 72 个。\n正文参考：段落中位约 25.0 字，对话约占 31%。\n使用提醒：只作题材参考，帮你抓常见场面和前中后写法；本书设定与同题材对标仍优先。"
    }
  },
  "structure": {
    "hook_notes": "适合用旧部现身、身份线索暴露、妻子态度变化、反派搬更大靠山、下一场公开场合收尾。\n\n开场落到家族饭桌、宴会、合同、医院或旧部上门；冲突落到被看轻的处境和隐忍理由；结尾落到旧部称呼、资源到场、妻子态度变化或更大靠山。",
    "arc_rhythm_notes": "每章先给具体压迫，再给隐忍理由，最后至少见结果一个身份、资源或实力差距。不能连续多章只受辱不回击。\n\n- 前期：用家族饭桌、医院、宴会、合同或旧部上门制造被看轻的处境，同时给隐忍理由。\n- 中期：让危险、靠山、资源和妻子态度轮流变动，打脸必须分层，不要一次亮完身份。\n- 后期：把旧部称呼、资源到场和更大靠山推成公开清算，结尾回到妻子或家族关系变化。"
  },
  "commercial": {
    "payoff_notes": "释放来自当众反转、旧部称呼、资源到场、恶人失算、妻子/家族态度变化。见证者必须在场。"
  }
}
