{
  "meta": {
    "id": "genre-xingguang",
    "name": "星光璀璨",
    "kind": "genre-prose-card",
    "sub_tags": [
      "星光璀璨",
      "娱乐圈",
      "文娱",
      "影后",
      "综艺"
    ],
    "target_platform": "长篇通用",
    "confidence": 0.85,
    "upgrade_status": "seed",
    "provenance": {
      "source": "zenstory-ai/oh-story-claudecode",
      "license": "MIT",
      "copyright": "Copyright (c) 2025-2026 oh-story-claudecode",
      "verified": false,
      "evidence": "样本说明：本地同题材长篇样本，可用 343 本；抽样 24 本，前/中/后章节段 24/24/24，共 72 个。\n正文参考：段落中位约 31.8 字，对话约占 28%，系统/面板提示约 11%。\n使用提醒：只作题材参考，帮你抓常见场面和前中后写法；本书设定与同题材对标仍优先。",
      "converted_at": "2026-09-09T06:21:51+00:00"
    },
    "source_books": []
  },
  "language_rules": {
    "forbidden_elements": [
      "不要只写网友震惊",
      "不要才华展示没有具体内容",
      "不要忽略经纪资源和舆论后果",
      "不要把娱乐圈写成校园换皮"
    ],
    "banned_phrases": [],
    "voice_notes": "经纪人重资源，导演/制片重利益，粉丝/网友情绪化，艺人台词要有镜头感和自保意识。别让所有人像营销号。"
  },
  "prose": {
    "sections": {
      "正文提示词": "写星光璀璨/娱乐圈时，让才华、舆论、资源、镜头和公开评价构成爽点链。正文按“被质疑、展示、反响、资源变化”推进，能力必须通过舞台、考试、直播、热搜、剧组或业内评价看见。",
      "开场抓手": "高考/试镜/节目开录、黑热搜、合约争议、对家挑衅、镜头事故、公开问答都适合切入。",
      "冲突发动机": "公开评价 + 资源竞争 + 才华被看见。主角要拿出具体作品或操作，别只让网友震惊。",
      "爽点与情绪释放": "释放来自舞台表现、镜头反应、热搜反转、业内评价、资源升级、黑粉失算。才华必须通过公开场面被看见。",
      "对话与声线": "经纪人重资源，导演/制片重利益，粉丝/网友情绪化，艺人台词要有镜头感和自保意识。别让所有人像营销号。",
      "章尾钩子": "用热搜发酵、下一轮节目、业内邀约、合同变化、对家反击、家人/身份公开收尾。",
      "场景颗粒": "用直播间、热搜截图、试镜房、录音棚、舞台灯、通告单、合同、粉丝评论、剧组现场承载娱乐圈反馈。",
      "正文落点": "开场落到试镜、热搜、合同、综艺现场或经纪人催促；冲突落到公众评价和职业资源争夺；结尾落到新通告、偷拍视频、榜单变化或角色邀约。",
      "前中后期打法": "- 前期：用试镜、热搜、合同、综艺现场或经纪人催促压出职业低谷和舆论误判。\n- 中期：让作品机会、公众评价、粉丝反馈和对手操作反复变化，爽点落在资源转向和能力被看见。\n- 后期：把榜单、奖项、偷拍视频或角色邀约放到明面上见结果，结尾留新通告或更大舆论风险。",
      "节奏密度": "每章至少推进两环：被质疑，展示，反响，资源变化。爽点之后要给资源后果，不只写全网震惊。",
      "本章取舍": "事业线和感情线不要互相吞。若本章重舞台，就少写舆论解释；若重舆论，就让一个具体资源或关系变化落地。",
      "禁止漂移": "不要只写网友震惊；不要才华展示没有具体内容；不要忽略经纪资源和舆论后果；不要把娱乐圈写成校园换皮。",
      "证据摘要": "样本说明：本地同题材长篇样本，可用 343 本；抽样 24 本，前/中/后章节段 24/24/24，共 72 个。\n正文参考：段落中位约 31.8 字，对话约占 28%，系统/面板提示约 11%。\n使用提醒：只作题材参考，帮你抓常见场面和前中后写法；本书设定与同题材对标仍优先。"
    }
  },
  "structure": {
    "hook_notes": "用热搜发酵、下一轮节目、业内邀约、合同变化、对家反击、家人/身份公开收尾。\n\n开场落到试镜、热搜、合同、综艺现场或经纪人催促；冲突落到公众评价和职业资源争夺；结尾落到新通告、偷拍视频、榜单变化或角色邀约。",
    "arc_rhythm_notes": "每章至少推进两环：被质疑，展示，反响，资源变化。爽点之后要给资源后果，不只写全网震惊。\n\n- 前期：用试镜、热搜、合同、综艺现场或经纪人催促压出职业低谷和舆论误判。\n- 中期：让作品机会、公众评价、粉丝反馈和对手操作反复变化，爽点落在资源转向和能力被看见。\n- 后期：把榜单、奖项、偷拍视频或角色邀约放到明面上见结果，结尾留新通告或更大舆论风险。"
  },
  "commercial": {
    "payoff_notes": "释放来自舞台表现、镜头反应、热搜反转、业内评价、资源升级、黑粉失算。才华必须通过公开场面被看见。"
  }
}
