{
  "meta": {
    "id": "genre-gufeng-shiqing",
    "name": "古风世情",
    "kind": "genre-prose-card",
    "sub_tags": [
      "古风世情",
      "古代世情",
      "古风家宅",
      "古代婚恋世情"
    ],
    "target_platform": "长篇通用",
    "confidence": 0.85,
    "upgrade_status": "seed",
    "provenance": {
      "source": "zenstory-ai/oh-story-claudecode",
      "license": "MIT",
      "copyright": "Copyright (c) 2025-2026 oh-story-claudecode",
      "verified": false,
      "evidence": "样本说明：本地同题材长篇样本，可用 2460 本；抽样 24 本，前/中/后章节段 24/24/24，共 72 个。\n正文参考：段落中位约 30.0 字，对话约占 29%。\n使用提醒：只作题材参考，帮你抓常见场面和前中后写法；本书设定与同题材对标仍优先。",
      "converted_at": "2026-09-09T06:21:51+00:00"
    },
    "source_books": []
  },
  "language_rules": {
    "forbidden_elements": [
      "不要只写辞藻",
      "不要现代价值观硬喊口号",
      "不要无证据硬撕",
      "不要让规矩只约束反派不约束主角"
    ],
    "banned_phrases": [],
    "voice_notes": "亲戚说话多绕弯、长辈重面子、晚辈要顾名分。主角可以锋利，但要借规矩、证据、人情说话。"
  },
  "prose": {
    "sections": {
      "正文提示词": "写古风世情时，把礼法、家族面子、婚姻名分、人情账和物证写成冲突核心。爽点来自主角在规矩里抓住把柄、翻转名声或让恶人自食其果。",
      "开场抓手": "婚约变故、家宴发难、亲戚争产、账册物证、族老公堂、邻里流言都适合切入。",
      "冲突发动机": "名分规矩 + 家族利益 + 人证物证。主角不能只靠嘴硬，要拿得出能改变场面的证据或策略。",
      "爽点与情绪释放": "释放来自证据摆出、长辈改口、婚约/产业/名声变化、恶人被人情账反咬。情绪不靠大喊，靠场内位置和众人态度变化。",
      "对话与声线": "亲戚说话多绕弯、长辈重面子、晚辈要顾名分。主角可以锋利，但要借规矩、证据、人情说话。",
      "章尾钩子": "用新物证、长辈召见、婚约变化、族中判罚、恶人反咬收尾。",
      "场景颗粒": "抓家宴席位、族谱、婚书、账册、库房钥匙、邻里传话、祠堂、公堂、聘礼嫁妆。世情味来自办事流程和人情往来。",
      "正文落点": "开场落到家宴席位、账册、婚书、库房钥匙或邻里流言；冲突落到名分、人情账和证据；结尾落到新物证、长辈召见或婚产判定变化。",
      "前中后期打法": "- 前期：用家宴席位、账册、婚书、库房钥匙或邻里流言立住名分和人情账。\n- 中期：让证据、长辈态度、亲戚算盘和钱产分配反复拉扯，每个小场都要改变关系位置。\n- 后期：把婚产、名声、宗族和官面结果推到一处结算，结尾用新物证或长辈召见续局。",
      "节奏密度": "每章推进一笔人情账、名声账或财产账。低压章也要让一个人重新站队，或让一件物证改变后续局面。",
      "本章取舍": "少写泛古风氛围，多写谁占规矩、谁占证据、谁占人心。若本章重感情，就让感情受名分和家族利益约束。",
      "禁止漂移": "不要只写辞藻；不要现代价值观硬喊口号；不要无证据硬撕；不要让规矩只约束反派不约束主角。",
      "证据摘要": "样本说明：本地同题材长篇样本，可用 2460 本；抽样 24 本，前/中/后章节段 24/24/24，共 72 个。\n正文参考：段落中位约 30.0 字，对话约占 29%。\n使用提醒：只作题材参考，帮你抓常见场面和前中后写法；本书设定与同题材对标仍优先。"
    }
  },
  "structure": {
    "hook_notes": "用新物证、长辈召见、婚约变化、族中判罚、恶人反咬收尾。\n\n开场落到家宴席位、账册、婚书、库房钥匙或邻里流言；冲突落到名分、人情账和证据；结尾落到新物证、长辈召见或婚产判定变化。",
    "arc_rhythm_notes": "每章推进一笔人情账、名声账或财产账。低压章也要让一个人重新站队，或让一件物证改变后续局面。\n\n- 前期：用家宴席位、账册、婚书、库房钥匙或邻里流言立住名分和人情账。\n- 中期：让证据、长辈态度、亲戚算盘和钱产分配反复拉扯，每个小场都要改变关系位置。\n- 后期：把婚产、名声、宗族和官面结果推到一处结算，结尾用新物证或长辈召见续局。"
  },
  "commercial": {
    "payoff_notes": "释放来自证据摆出、长辈改口、婚约/产业/名声变化、恶人被人情账反咬。情绪不靠大喊，靠场内位置和众人态度变化。"
  }
}
