{
  "meta": {
    "id": "genre-qingchun-tianchong",
    "name": "青春甜宠",
    "kind": "genre-prose-card",
    "sub_tags": [
      "青春甜宠",
      "校园甜宠",
      "校园恋爱",
      "青春校园"
    ],
    "target_platform": "长篇通用",
    "confidence": 0.65,
    "upgrade_status": "seed",
    "provenance": {
      "source": "zenstory-ai/oh-story-claudecode",
      "license": "MIT",
      "copyright": "Copyright (c) 2025-2026 oh-story-claudecode",
      "verified": false,
      "evidence": "样本说明：本地同题材长篇样本，可用 143 本；抽样 24 本，前/中/后章节段 24/24/24，共 72 个。\n正文参考：段落中位约 26.8 字，对话约占 24%，系统/面板提示约 8%。\n使用提醒：只作题材参考，帮你抓常见场面和前中后写法；本书设定与同题材对标仍优先。",
      "converted_at": "2026-09-09T06:21:51+00:00"
    },
    "source_books": []
  },
  "language_rules": {
    "forbidden_elements": [
      "不要只写脸红心跳",
      "不要连续撒糖没有外部压力",
      "不要成人化油腻",
      "不要让校园规则消失"
    ],
    "banned_phrases": [],
    "voice_notes": "台词要年轻、别扭、嘴硬，有停顿和转移话题。不要让高中生说霸总式台词，也不要全员网络段子手。"
  },
  "prose": {
    "sections": {
      "正文提示词": "写青春甜宠时，把校园、同学、家庭、误会、公开围观和小危险变成感情推进器。甜要落在试探、护短、别扭、吃醋、共同面对麻烦里，不能只靠互夸。每章关系要有一点可见变化。",
      "开场抓手": "从换座位、考试排名、同学起哄、家长电话、社团活动、雨天接送、校园误会、一次小伤小险切入。",
      "冲突发动机": "青春身份限制 + 同龄人围观 + 不敢说破的好感。冲突轻中有钩，甜点短而密。",
      "爽点与情绪释放": "释放来自公开维护、称呼变化、消息置顶、帮忙补课、一起承担惩罚、误会后低头。让关系前进一步就够，不必每章大告白。",
      "对话与声线": "台词要年轻、别扭、嘴硬，有停顿和转移话题。不要让高中生说霸总式台词，也不要全员网络段子手。",
      "章尾钩子": "适合用新座位、新分组、下一次考试/比赛、家长发现、同学误会升级、未发出的消息收尾。",
      "场景颗粒": "用课桌距离、草稿纸、校服外套、便利店、成绩单、班群消息、操场、社团道具、家长电话承载甜点和压力。",
      "正文落点": "开场落到班级、宿舍、考试、社团、校门口或一条消息；冲突落到误会、竞争和青春期面子；结尾落到约定、公开围观、成绩/比赛变化或暧昧证据。",
      "前中后期打法": "- 前期：用班级、宿舍、考试、社团、校门口或一条消息制造误会和青春期面子。\n- 中期：围绕成绩/比赛、同学围观、约定落地和小吃醋推进，甜点要和具体事件绑定。\n- 后期：把公开围观、成绩变化和暧昧证据合并，结尾留下一次约定或关系被同学看见。",
      "节奏密度": "每章一个小压力、一个小靠近、一个未说破的余波。甜点短而准，关系变化要能被下一章继承。",
      "本章取舍": "校园规则和同龄人围观不能消失。若本章重撒糖，就留一个考试、家长或同学误会压力；若重冲突，就给读者一个关系安全感回扣。",
      "禁止漂移": "不要只写脸红心跳；不要连续撒糖没有外部压力；不要成人化油腻；不要让校园规则消失。",
      "证据摘要": "样本说明：本地同题材长篇样本，可用 143 本；抽样 24 本，前/中/后章节段 24/24/24，共 72 个。\n正文参考：段落中位约 26.8 字，对话约占 24%，系统/面板提示约 8%。\n使用提醒：只作题材参考，帮你抓常见场面和前中后写法；本书设定与同题材对标仍优先。"
    }
  },
  "structure": {
    "hook_notes": "适合用新座位、新分组、下一次考试/比赛、家长发现、同学误会升级、未发出的消息收尾。\n\n开场落到班级、宿舍、考试、社团、校门口或一条消息；冲突落到误会、竞争和青春期面子；结尾落到约定、公开围观、成绩/比赛变化或暧昧证据。",
    "arc_rhythm_notes": "每章一个小压力、一个小靠近、一个未说破的余波。甜点短而准，关系变化要能被下一章继承。\n\n- 前期：用班级、宿舍、考试、社团、校门口或一条消息制造误会和青春期面子。\n- 中期：围绕成绩/比赛、同学围观、约定落地和小吃醋推进，甜点要和具体事件绑定。\n- 后期：把公开围观、成绩变化和暧昧证据合并，结尾留下一次约定或关系被同学看见。"
  },
  "commercial": {
    "payoff_notes": "释放来自公开维护、称呼变化、消息置顶、帮忙补课、一起承担惩罚、误会后低头。让关系前进一步就够，不必每章大告白。"
  }
}
