{"commercial":{"payoff_notes":"奖励公布要有观众：前女友、势利亲戚、看不起他的同学。花钱要有回响：买楼收租、收购公司、布局产业。打脸要当场：羞辱他的人，三个回合内必须付出代价。"},"language_rules":{"banned_phrases":[],"forbidden_elements":["不要让系统奖励没有规则，任务难度和奖励要成正比，否则爽感贬值","不要只写花钱，钱要花出故事：产业、布局、人脉","不要让系统沦为传声筒，系统性格、限制和隐藏逻辑本身也是看点","不要让主角暴富后行为逻辑不变，财富必须改变他的社交圈和敌人量级"],"voice_notes":"系统提示音要干脆利落，奖励公布带仪式感；主角前期装穷后期不装了，台词从谨慎变张扬；势利眼配角前后嘴脸反差要大。别让系统每章只会说“叮，任务完成”。"},"meta":{"confidence":0.4,"id":"genre-dushi-xitong","kind":"genre-prose-card","name":"都市系统","provenance":{"converted_at":"2026-09-30T01:50:00+08:00","copyright":"Copyright (c) 2026 novel-lab (agent-authored original seed)","evidence":"本卡为 AI 辅助原创种子卡，未经同题材样本拆书实测；置信度 0.4 为来源自报低值。只作题材参考，帮你抓常见场面和前中后写法；本书设定与同题材对标仍优先。","license":"MIT","source":"novel-lab-agent-authored","verified":false},"source_books":[],"sub_tags":["都市系统","神豪","签到","系统流","返利","开挂","爽文"],"target_platform":"长篇通用","upgrade_status":"seed"},"prose":{"sections":{"冲突发动机":"系统任务倒计时 + 势利眼打压 + 财富暴露引来的觊觎。旁人按“穷小子”误判主角，主角以系统奖励、信息差和钞能力打破判断。","前中后期打法":"- 前期：用绑定系统、首杀打脸、第一桶金立住“神豪”人设，爽感密集不憋屈。\n- 中期：围绕产业布局、系统升级、神秘势力关注推进，任务难度和奖励同步加码。\n- 后期：把系统真相、终极任务推到明面上见结果，结尾留新世界或新系统形态。","场景颗粒":"用手机到账短信、银行卡余额、豪车钥匙、售楼处、拍卖槌、深夜便利店的灯承载暴富前后的反差感。","对话与声线":"系统提示音干脆利落，奖励公布带仪式感；主角前期装穷后期不装了，台词从谨慎变张扬；势利眼配角前后嘴脸反差要大。别让系统每章只会说“叮，任务完成”。","开场抓手":"- 用出租屋、同学聚会、分手现场、前台羞辱切入。\n- 先给主角的人生低谷，再给“叮”的一声命运转折。\n- 系统规则只给当前任务需要的部分，不要开篇写说明书。","开篇钩子公式":"- 开局“叮”一声绑定系统，首个任务奖励一栋楼/一个亿。\n- 被前女友/势利亲戚羞辱，系统到账，当场反杀。\n- 签到第一天奖励平平，连续签到解锁隐藏大奖。","本章取舍":"系统跟着任务走，爽感跟着打脸走。规则感不能丢，爽感不能等。","正文提示词":"写都市系统，系统是发动机，爽感是燃料。每个任务都要回答：奖励为什么让人眼红，代价为什么让人捏汗。把“叮”写出心跳感，把奖励写出仪式感，把花钱写出故事感。","正文落点":"开场落到人生低谷、羞辱现场或出租屋；冲突落到任务倒计时、打脸和财富暴露；结尾落到奖励到账、布局落子或新系统功能。","爽点与情绪释放":"奖励公布要有观众：前女友、势利亲戚、看不起他的同学。花钱要有回响：买楼收租、收购公司、布局产业。打脸要当场：羞辱他的人，三个回合内必须付出代价。","示例开篇":"“叮！神豪系统绑定成功。宿主：苏晨，当前资产：-2580元（花呗待还）。”\n苏晨盯着手机屏幕，怀疑自己加班加出了幻觉。\n“叮！新手任务发布：请在十分钟内，花掉系统预付的100万元。任务奖励：消费金额十倍返利。”\n银行卡到账短信几乎同时响起：一长串零，苏晨数了三遍。\n“这……这是真的？”\n他抬头看了眼对面。前女友正挽着一个开保时捷的男人，笑得花枝乱颤：“苏晨，不是我现实，你连一顿像样的分手饭都请不起。”\n苏晨把手机揣回兜里，站起身，走到收银台：“这家店，我买了。”\n全场死寂。\n“叮！消费100万元完成。十倍返利到账：1000万元。”","禁止漂移":"不要让系统奖励没有规则，任务难度和奖励要成正比，否则爽感贬值；不要只写花钱，钱要花出故事：产业、布局、人脉；不要让系统沦为传声筒，系统性格、限制和隐藏逻辑本身也是看点；不要让主角暴富后行为逻辑不变。","章尾钩子":"适合用隐藏任务触发、系统升级/新功能解锁、神秘势力注意到宿主、返利出现异常收尾。","节奏密度":"每章一个任务或一场打脸，奖励和冲突交替推进。任务、奖励、布局不要断成互不相关的清单。","证据摘要":"本卡为 AI 辅助原创种子卡，未经同题材样本拆书实测；置信度 0.4 为来源自报低值。只作题材参考，帮你抓常见场面和前中后写法；本书设定与同题材对标仍优先。","语气风格":"轻快浮夸、爽感密集。系统提示音式节奏，奖励公布要有仪式感；打脸场面要快，装逼场面要足，绝不憋屈过夜。","题材简介":"绑定神豪/签到/返利系统，任务越做奖励越离谱。从一无所有到富可敌国，都市生活直接开挂，打脸、装逼、布局，一气呵成。"}},"structure":{"arc_rhythm_notes":"每章一个任务或一场打脸，奖励和冲突交替推进。任务、奖励、布局不要断成互不相关的清单。前期爽感密集，中期任务加码产业布局，后期揭系统真相。","hook_notes":"适合用隐藏任务触发、系统升级/新功能解锁、神秘势力注意到宿主、返利出现异常收尾。开场落到人生低谷、羞辱现场或出租屋；冲突落到任务倒计时、打脸和财富暴露；结尾落到奖励到账、布局落子或新系统功能。"}}